{
  "task_id": "TASK001",
  "site_id": "SITE_A",
  "zone_id": "ZONE_A",
  "title": "Excavation — Zone A",
  "task_type": "EXCAVATION",
  "priority": "HIGH",
  "target": {
    "unit": "cycles",
    "value": 50.0
  },
  "planned_start": "2026-09-23T02:30:00Z",
  "planned_end": "2026-09-23T05:00:00Z",
  "assistance": [
    {
      "kind": "MACHINE",
      "resource_id": "DMP002",
      "note": "Dumper D2 assists with haulage"
    }
  ],
  "status": "PLANNED",
  "created_at": "2026-09-23T01:55:00Z",
  "updated_at": "2026-09-23T02:02:00Z",
  "changed_fields": null
}
